{
  "$schema": "https://agent-project-os.org/schemas/supervision-review-v1.schema.json",
  "note": "E2 and E3 remain distinct", "outcome": "accepted", "project_id": "service",
  "protocol_version": "1.0", "report_id": "service-week-34", "review_id": "service-week-34",
  "review_type": "supervision_report", "reviewed_at": "2026-08-18T03:00:00Z", "reviewed_by": "agent:pmo"
}
