{
  "$schema": "https://agent-project-os.org/schemas/supervision-review-v1.schema.json",
  "note": "Evidence pointer is coherent", "outcome": "accepted", "project_id": "contracts",
  "protocol_version": "1.0", "report_id": "contracts-week-34", "review_id": "contracts-week-34",
  "review_type": "supervision_report", "reviewed_at": "2026-08-18T02:00:00Z", "reviewed_by": "agent:pmo"
}
